Category,Parties,Agreement Date,Effective Date,Expiration Date,Renewal Term,Governing Law,Exact Law,Law Explanation
Co_Branding,"['Impresse Corporation', 'VerticalNet, Inc.', 'VerticalNet', 'Impresse']","['March 3, 2000']","['March 3, 2000']",['The Term of this Agreement shall begin on the Effective Date and shall end fifteen months therefrom.'],[],International Law,WIPO Treaties & International Trademark Laws,Governs international brand collaborations and trademark protection
Co_Branding,"['ebix.com, Inc.', 'ebix', 'About', 'About.com, Inc.']","['19th day of January, 2001']","['19th day of January, 2001']","['The term of this Agreement (the ""Term"") shall commence on the date hereof (the ""Effective Date"") and shall expire upon delivery of [**] to ebix, but in no way shall this Agreement extend any later than thirty (30) months from the Effective Date regardless of the number Filled Application Forms delivered to ebix. About will make commercially reasonable efforts to achieve that number in twelve (12) months or less from the Effective Date.']",[],International Law,WIPO Treaties & International Trademark Laws,Governs international brand collaborations and trademark protection
Co_Branding,"['At Home Corporation (""Excite@Home"" or ""Excite"")', 'e-centives, Inc., (""Application Provider"" or ""e-centives"")']","['16th day of February, 2000']","['16th day of February, 2000']","['The term of this Agreement will begin on the Effective Date and will end three (3) years from the date the Co-Branded Application becomes accessible to Excite@Home Members (""Launch Date"").']",[],International Law,WIPO Treaties & International Trademark Laws,Governs international brand collaborations and trademark protection
Co_Branding,"['Lucent Technologies Inc.', 'Lucent', 'mPhase Technologies Inc.', '(each individually, ""a Party"" and, collectively, ""the Parties""}.', 'mPhase']",['21st day of January 2003'],[],"['The Term of this Agreement will commence on the date above, and shall continue for a term of one (1) year']","['mPhase shall have the right to annually renew this agreement for a period of one year upon each annual expiration with the written consent of Lucent, which written consent shall not be unreasonably withheld.']",International Law,WIPO Treaties & International Trademark Laws,Governs international brand collaborations and trademark protection
Co_Branding,"['VerticalNet', 'LeadersOnline', 'VerticalNet, Inc.', '(each a ""Party"" and together the ""Parties"").', 'LeadersOnline, Inc.']","['March 15, 2000']","['March 15, 2000']","['Term shall mean the Effective Date through June 15, 2001 and any Renewal Term (as defined in paragraph 7.4 herein.)']","['LeadersOnline shall have the option, subject to VerticalNet\'s approval exercised in its sole and absolute discretion, to extend the Term of this Agreement for an additional 12 months (a ""Renewal Term"") on such terms and conditions as may be mutually agreed upon by the Parties.']",International Law,WIPO Treaties & International Trademark Laws,Governs international brand collaborations and trademark protection
Co_Branding,"['VerticalNet, Inc.', 'VerticalNet', 'Neoforma', 'Neoforma.com, Inc.']","['November 19, 1999']","['November 19, 1999']","['INITIAL TERM shall mean the Effective Date through the day prior to the second anniversary of the Effective Date, unless earlier terminated pursuant to Section 11.']","['This Agreement will automatically renew at the end of the Initial Term or a subsequent renewal term on a year to year basis (each, a ""Renewal Term""), unless either Party notifies the other at least 30 days prior to the end of the Initial Term or then current Renewal Term, as applicable, of its intention not to renew this Agreement (a ""Termination Notice"").']",International Law,WIPO Treaties & International Trademark Laws,Governs international brand collaborations and trademark protection
Co_Branding,"['PaperExchange', 'PaperExchange.com, LLC', 'VerticalNet, Inc.', 'VerticalNet']",[],"['September 30, 1999']","['Initial Term shall mean the Effective Date through the day prior to the fourth anniversary of the Effective Date, unless earlier terminated pursuant to Section 8']","['This Agreement will automatically renew at the end of the Initial Term or a subsequent renewal term on a year to year basis (each, a ""Renewal Term""), unless either party notifies the other at least 30 days prior to the end of the Initial Term or then current Renewal Term, as applicable, of its intention not to renew this Agreement.']",International Law,WIPO Treaties & International Trademark Laws,Governs international brand collaborations and trademark protection
Co_Branding,"['NETTAXI', '""SpinRecords.com"" or ""Client""', 'Solutions Media, Inc., dba SpinRecords.com', 'NETTAXI Online Communities, Inc.']","['Nov 5, 1999']","['Nov 5, 1999']","['This Agreement shall be effective upon the ------------------- Effective Date and shall remain in force for a period of one (1) year, and shall be automatically renewed for successive periods of one (1) year unless otherwise terminated as provided herein.']","['This Agreement shall be effective upon the<omitted>Effective Date and shall remain in force for a period of one (1) year, and shall be automatically renewed for successive periods of one (1) year unless otherwise terminated as provided herein.']",International Law,WIPO Treaties & International Trademark Laws,Governs international brand collaborations and trademark protection
Co_Branding,"['PlanetCAD Inc. (formerly known as Spatial Technology Inc.)', '(""Dassault Systemes"") and/or certain affiliates of Dassault Systemes,', 'PlanetCAD', 'Dassault Systemes', '(each a ""Party,"" together, the ""Parties"").']","['November 14, 2000']","['November 14, 2000']","['This Agreement shall be effective as of the Effective Date and shall continue in force for three years from the Launch Date (the ""Initial Term"") unless earlier']",['The Agreement shall automatically renew for successive one year additional terms unless terminated by either party at least six months prior to the expiration of the then-current term.'],International Law,WIPO Treaties & International Trademark Laws,Governs international brand collaborations and trademark protection
Co_Branding,"['The Boxlot Company', 'Boxlot', 'theglobe', 'theglobe.com, Inc.']","['March ___, 1999']","['March ___, 1999']","['""Launch Date"" means the first date on which the Service is made publicly available.<omitted>This Agreement will become effective on the Effective Date and will continue in effect for 2 years following the Launch Date.']",[],International Law,WIPO Treaties & International Trademark Laws,Governs international brand collaborations and trademark protection
Co_Branding,"['MBE', 'iShip.com, Inc.', 'MAILBOXES ETC. USA, INC.', 'Mail ------- Boxes Etc. USA, Inc.', 'Company']","['April 27, 1999']","['April 27, 1999']",['The initial term of this Agreement shall ----------------------- commence on the Effective Date and end on the fifth anniversary of the Effective Date.'],"['MBE shall have the right to elect by written notice to the Company at any time between two (2) and six (6) months prior to the end of such initial term or any subsequent Renewal Period (as defined below), to notify the Company that MBE elects to seek to extend such term for additional two (2)-year periods (each a ""Renewal Period"") In the event of such election, MBE and the Company shall have -------------- a period of sixty (60) days in which to negotiate commercially reasonable Basic Fees, Bounty Fees and eBay Fees (and other applicable fees) (""Fee Schedule"") ------------ under which the Company would be willing to renew this Agreement for such Renewal Period.', 'If MBE notifies the Company of its intent to so renew prior to the end of such initial term or such Renewal Period, the term of this Agreement shall automatically be extended for the Renewal Period and, other than the Fee Schedule, all of the terms and conditions of this Agreement shall remain in full force and effect.']",International Law,WIPO Treaties & International Trademark Laws,Governs international brand collaborations and trademark protection
Endorsement,"['Joseph Theismann', 'Bizzingo, Inc.', 'Theismann', 'Bizzingo']","['March 14, 2012']","['March 1, 2012']","['Unless sooner terminated under the provisions hereof, this Agreement shall commence on the Effective Date and continue for a period of one (1) year (""Term""). provided however, that the Parties may extend the Term for an additional year period by entering into an written addendum of the Agreement extending such term.']","['Unless sooner terminated under the provisions hereof, this Agreement shall commence on the Effective Date and continue for a period of one (1) year (""Term""). provided however, that the Parties may extend the Term for an additional year period by entering into an written addendum of the Agreement extending such term.']",International Law,International Law - General Contract Laws,Standard contractual obligations and business regulations apply
Endorsement,"['Berkshire', 'BERKSHIRE BANK', 'Auriemma', 'GENO AURIEMMA', '(Each or both of which shall hereinafter be referred to as the ""PARTY"" or ""PARTIES,"" respectively).']",['5/17/12'],[],"['""CONTRACT PERIOD"" means that period of time commencing upon the full execution of this Agreement by both Parties and terminating on May 31, 2016 unless sooner terminated under this Agreement.']",[],International Law,International Law - General Contract Laws,Standard contractual obligations and business regulations apply
Endorsement,"['NFLA-NC', 'National Football League Alumni, Inc.', 'Gridiron BioNutrients™', 'NFLA', 'National Football League Alumni - Northern California Chapter', 'Food For Athletes, Inc', '(collectively the ""Company"").']","['October 30, 2017']","['All terms of this Agreement will automatically commence on November 1st, 2017, and expire on November 2nd, 2020.']","['All terms of this Agreement will automatically commence on November 1st, 2017, and expire on November 2nd, 2020.']",[],International Law,International Law - General Contract Laws,Standard contractual obligations and business regulations apply
Endorsement,"['Celebrity Speakers', 'Tigrent Learning UK Limited', 'CSA', 'Talent', 'Robbie Fowler', 'Company']",['____ day of ______________ 2013'],"['""Commencement Date"" means: 1st January 2013.']","['""Term"" means: 1.5t January 2013 to 315t December 2013 or until terminated under the provisions of this Agreement or the Primary Agreement.']",['The period of license granted shall be for the Term and shall extend for a period of twenty four (24) months or until terminated as per clause 8 herein.'],International Law,International Law - General Contract Laws,Standard contractual obligations and business regulations apply
Endorsement,"['Ludmila Smolyansky', 'Lifeway', 'Individual', 'Lifeway Foods, Inc.']","['14th day of March, 2016']","['14th day of March, 2016']",[],[],International Law,International Law - General Contract Laws,Standard contractual obligations and business regulations apply
Endorsement,"['Andy North', 'Company', 'Golfers Incorporated', 'North']",['21s t day of February 2011'],"['February 21, 2011']","['""Contract Period"" shall mean that period of time from February 21, 2011 through December 31, 2012.']",[],International Law,International Law - General Contract Laws,Standard contractual obligations and business regulations apply
Endorsement,"['""Celebrity', 'Healthcare Distribution Specialists LLC', 'HDS', 'Paul Silas']","['February 20, 2012']","['February 20, 2012']","['The term of this Agreement shall be for one (1) year commencing on the Effective Date and ending on February 19, 2013 (""Term"").']",[],International Law,International Law - General Contract Laws,Standard contractual obligations and business regulations apply
Endorsement,"['""Employer"")', 'Prudential Bank', 'Employee', 'Jeffrey Hanuscin']","['1st day of June, 2017']","['1st day of June, 2017<omitted>WHEREAS, it is now understood and agreed that this split-dollar agreement is to be effective as of the date first listed above;']",[],[],International Law,International Law - General Contract Laws,Standard contractual obligations and business regulations apply
Endorsement,['Thrivent Financial for Lutherans'],"['July 1, 2019']","['July 1, 2019']",[],[],International Law,International Law - General Contract Laws,Standard contractual obligations and business regulations apply
Development,"['Fund', 'Blockchain Administrator', 'ARCA CAPITAL MANAGEMENT, LLC', 'ARCA U.S. TREASURY FUND,']","['[___], 2020']",['This Agreement shall become effective as of the first date above written'],"['This Agreement shall continue in effect for two years from the date hereof, and thereafter shall continue automatically for successive annual periods, provided that such continuance is specifically approved at least annually by (A) the vote of the Board, or by the vote of a majority of the outstanding voting securities of the Fund and (B) the vote of a majority of the Fund\'s directors who are not parties to this Agreement or ""interested persons"" (as such term is defined in Section 2(a)(19) of the Investment Fund Act) of any such party, in accordance with the requirements of the Investment Fund Act.']","['This Agreement shall continue in effect for two years from the date hereof, and thereafter shall continue automatically for successive annual periods, provided that such continuance is specifically approved at least annually by (A) the vote of the Board, or by the vote of a majority of the outstanding voting securities of the Fund and (B) the vote of a majority of the Fund\'s directors who are not parties to this Agreement or ""interested persons"" (as such term is defined in Section 2(a)(19) of the Investment Fund Act) of any such party, in accordance with the requirements of the Investment Fund Act.']",International Law,UNCITRAL Model Law on Electronic Commerce,Framework for international software development and digital services
Development,"['Xencor and Aimmune are sometimes referred to herein individually as a ""Party"" and collectively as the ""Parties"".', 'Xencor', 'Aimmune', 'Aimmune Therapeutics, Inc.', 'Xencor, Inc.']","['FEBRUARY 4, 2020']","['February 4, 2020']","['This Agreement shall become effective on the Effective Date and, unless earlier terminated pursuant to this ARTICLE 13, shall remain in effect on a Product-by-Product and country-by-country basis until the expiration of the Royalty Term applicable to such Product and country (the ""Term"").']",[],International Law,UNCITRAL Model Law on Electronic Commerce,Framework for international software development and digital services
Development,"['CNS and WPD are sometimes referred to herein individually as a ""Party"" and collectively as the ""Parties.""', 'WPD', 'CNS Pharmaceuticals, Inc.', 'CNS', 'WPD Pharmaceuticals']","['March 20, 2020']","['March 20, 2020']","['The term of this Agreement will commence on the Effective Date and remain in full force and effect until the expiration of the Sublicense Agreement, unless earlier termination by pursuant to the terms of this Agreement (""Term"").']",[],International Law,UNCITRAL Model Law on Electronic Commerce,Framework for international software development and digital services
Development,"['InfinixSoft Global LLC', 'Developer', 'Clickstream Corporation', 'Client']","['March 20, 2020']","['March 20, 2020']","['This Agreement shall become effective as of the Effective Date and, unless otherwise terminated in accordance with the provisions of Section 4 of this Agreement, will continue until the expiration of the Warranty Period as defined in subsection 9(a) of this Agreement.']",[],International Law,UNCITRAL Model Law on Electronic Commerce,Framework for international software development and digital services
Development,"['Licensee', 'Coherus BioSciences, Inc.', 'Bioeq', 'Bioeq IP AG']","['Nov. 02, 2019']","['Nov. 02, 2019']","[""Except as otherwise specified in this Agreement, the Parties' respective rights and obligations under this Agreement shall commence on the Effective Date and shall remain in full force for ten (10) years after the First Commercial Sale of the first Licensed Product, and shall thereafter automatically renew for an unlimited period of time unless otherwise terminated in accordance with Section 15.2.""]","[""Except as otherwise specified in this Agreement, the Parties' respective rights and obligations under this Agreement shall commence on the Effective Date and shall remain in full force for ten (10) years after the First Commercial Sale of the first Licensed Product, and shall thereafter automatically renew for an unlimited period of time unless otherwise terminated in accordance with Section 15.2.""]",International Law,UNCITRAL Model Law on Electronic Commerce,Framework for international software development and digital services
Development,"['""El Pollo Loco"" or ""Franchisor""', 'an individual', 'Developer', 'EL POLLO LOCO, INC.']",[],"['This Agreement shall commence on the date specified in Exhibit ""B"".']","['Notwithstanding any provision to the contrary contained herein, unless earlier terminated by either party, this Agreement shall expire on ______, 20___, and all rights of Developer herein shall cease and all unapplied or unused Development Fees paid pursuant to Section 3 hereof shall be forfeited to Franchisor.', 'Unless terminated pursuant to Section 10 or 11 below, it shall expire upon the earlier of the date specified in Exhibit ""B"" or upon the opening of the last El Pollo Loco® Restaurant listed in the Development Schedule.']",[],International Law,UNCITRAL Model Law on Electronic Commerce,Framework for international software development and digital services
Development,"['Emerald Health Nutraceuticals Inc.', 'EHS', 'EHN', 'Michael T. Murray, N.D', 'Dr. Murray', 'Emerald Health Sciences Inc.']",['1st day of September 2016'],['1st day of September 2016'],"['Dr. Murray\'s obligations set out herein shall be performed from the Effective Date until December 31, 2018 (the initial ""Services Term"").', 'Except as otherwise stated herein as pertaining only to a Services Term, this Agreement shall remain in effect for ten years, unless terminated in accordance with Sections 6.1 (a) or 6.2(b).']","[""The Services Term of this Agreement shall be automatically renewed for successive two-year terms thereafter unless written notice is given by either party to the other, indicating that party's intention not to renew the Services Term of this Agreement, at least ninety (90) days prior to the end of the initial Services Term or any renewed Services Term.""]",International Law,UNCITRAL Model Law on Electronic Commerce,Framework for international software development and digital services
Development,"['CC-Pharming', 'iBio Inc.', 'Beijing CC-Pharming Ltd.']","['August 08, 2018']","['The term of this Agreement (""Term"") will begin on the date this Agreement is signed by the last signatory (""Effective Date"") and remain in effect for [***]; provided, however, that the terms of this Agreement shall remain applicable to any SOW that was executed by the Parties prior to the expiration or termination of this Agreement but whose period of performance extends beyond the expiration or termination of this Agreement.<omitted>August 08, 2018']","['The term of this Agreement (""Term"") will begin on the date this Agreement is signed by the last signatory (""Effective Date"") and remain in effect for [***]; provided, however, that the terms of this Agreement shall remain applicable to any SOW that was executed by the Parties prior to the expiration or termination of this Agreement but whose period of performance extends beyond the expiration or termination of this Agreement.']",[],International Law,UNCITRAL Model Law on Electronic Commerce,Framework for international software development and digital services
Development,"['Developer', 'DSS', 'HotApp International Ltd.', 'Document Security Systems, Inc.']","['1s t day of March, 2018']","['1s t day of March, 2018']","['The initial term of this Agreement shall commence on the Effective Date, and shall continue thereafter for a period of twelve (12) months (the ""Initial Term"").']","['The Initial Term shall automatically renew for one-month periods thereafter unless either party provides 30- days advance notice of termination, unless earlier terminated pursuant to Section 2.2 hereof']",International Law,UNCITRAL Model Law on Electronic Commerce,Framework for international software development and digital services
Development,"['T&B Seminars, Inc.', 'LEA', 'Legacy Education Alliance Holdings, Inc.', 'T&B']",['12-23-2019'],['12-23-2019'],"['The Term shall commence upon the Effective Date and shall continue for an initial term of five (5) years.', 'The term ""Term"" shall mean an initial term of five years, automatically renewable thereafter for successive 5-year terms unless either party provides prior written notice of termination not less than 90 days prior to the end of such five-year term; provided, however, T&B shall have the right to terminate the license after the first year of the Term if LEA does not conduct the Business so as to meet the Cash Sales benchmarks set by the parties for years two through five of the Term, as set forth in Section 3.3, below.']",['The Term shall automatically renew thereafter for successive 5-year terms unless either party provides prior written notice of termination not less than 90 days prior to the end of such five-year term.'],International Law,UNCITRAL Model Law on Electronic Commerce,Framework for international software development and digital services
Development,"['LIQUIDMETAL TECHNOLOGIES, INC.', 'Eutectix', 'EUTECTIX, LLC', 'Liquidmetal']","[', 2020']","[', 2020']","['The initial term of this Agreement shall commence on the Effective Date and shall continue until the fifth (5t h) anniversary of the Effective Date (the ""Term""), unless the Agreement is sooner terminated in accordance with the terms of this Agreement.']","['Upon the expiration of the Term, the Term shall automatically extend for successive 12-month periods until one Party terminates the Agreement by providing at least 180 days prior written notice to the other Party prior to the expiration of the then-current term or unless sooner terminated in accordance with the terms of this Agreement.']",International Law,UNCITRAL Model Law on Electronic Commerce,Framework for international software development and digital services
Development,"['NLS-1 Pharma AG', 'Eurofarma Laboratórios S.A.', '""Licensee"" / ""Eurofarma""', '""Licensor"" / ""NLS""', '(Licensor and Licensee each a ʺPartyʺ collectively the ʺPartiesʺ)']",[],['Effective Date shall be the date of the last signature on the last page of this Agreement.'],"['This Agreement will come into effect on the Effective Date and shall continue in full force for ten (10) years from the Launch (the ""Initial Term""), or the date of expiry of the last valid patent of the Licensed Product, whichever comes later, subject to clauses 19.2, 19.3, 19.4 and 19.5 hereunder']",[],International Law,UNCITRAL Model Law on Electronic Commerce,Framework for international software development and digital services
Development,"['SFJ', 'each, a ""Party"" and collectively, the ""Parties"").', 'PhaseBio Pharmaceuticals Inc.', 'PB', 'SFJ Pharmaceuticals X, Ltd.']","['January 9, 2020']","['January 9, 2020']","['The term of this Agreement (the ""Term"") will commence on the Effective Date and will expire upon the earliest of (i) termination of this Agreement in accordance with Section 14.2, or (ii) the date of payment of the last Approval Payment due based on all applicable Regulatory Approvals which have been received.']",[],International Law,UNCITRAL Model Law on Electronic Commerce,Framework for international software development and digital services
Development,"['Revolution Medicines, Inc.', 'Sanofi and RevMed are referred to in this Agreement individually as a ""Party"" and collectively as the ""Parties.""', 'RevMed', 'Aventis, Inc.', 'Sanofi']","['June 8, 2018']","['June 8, 2018']","['The term of this Agreement shall commence upon the Effective Date and, unless earlier terminated pursuant to this Article XII, shall continue in full force and effect until the expiration of Sanofi\'s payment obligations under Article IX or the Profit/Loss Share Agreement, whichever is later (the ""Term"").']",[],International Law,UNCITRAL Model Law on Electronic Commerce,Framework for international software development and digital services
Development,"['Sekisui', 'Qualigen, Inc. and its Affiliates', 'Qualigen', 'Sekisui Diagnostics, LLC and its Affiliates']","['May 1, 2016']",[],"['The initial term of this Agreement shall commence on the Effective Date and shall continue for a period of five (5) years unless earlier terminated pursuant to Section 14 hereof (the ""Term"").']",['The initial term of this Agreement and any renewal term thereof shall be automatically extended at the end of the initial term and any renewal term thereof for an additional one (1) year period unless either Party notifies the other Party not less than six (6) months before the end of the then in effect term of its intent to terminate this Agreement.'],International Law,UNCITRAL Model Law on Electronic Commerce,Framework for international software development and digital services
